<?xml version="1.0" encoding="utf-8"?>
<!--
 
    Modify this XML layout definition and click the Update button
    to see your changes on the right.

    Try to move around the id attributes to see effects of the
    binding. For example you can move the bound data source of
    the Table to the Select. Or you can change the value change
    event handler from the RatingStars component to the DateField
    by moving the value-field id.
    
    Have fun!
     
-->
<VerticalLayout 
    xmlns="urn:import:com.vaadin.ui"
    xmlns:l="urn:vaadin:parent"
    xmlns:a="urn:import:org.vaadin.teemu.ratingstars"
    xmlns:xsi="http://www.w3.org/2001/XMLSchema-instance"
    xsi:schemaLocation="
urn:import:com.vaadin.ui clara-com_vaadin_ui.xsd
urn:import:org.vaadin.teemu.ratingstars clara-org_vaadin_teemu_ratingstars.xsd"
    margin="true"
    spacing="true">

    <Label id="label" contentMode="HTML" value="Welcome to &lt;strong&gt;Clara&lt;/strong&gt; demo application." />

    <HorizontalLayout caption="Horizontal button row" spacing="true">
        <Button id="button" caption="Click to invoke the controller" />
        <Button id="another-button" width="200px" caption="Click me too" />
    </HorizontalLayout>
    
    <DateField caption="Select a date" id="date" immediate="true" />

    <CssLayout width="60%">
        <Table id="person-list" width="100%" 
            caption="Controller provides my datasource..." pageLength="2" />
        <Select caption="...try moving the person-list id here" 
            itemCaptionPropertyId="Name" />
    </CssLayout>

    <a:RatingStars id="value-field" l:componentAlignment="MIDDLE_CENTER" 
        immediate="true" caption="Add-ons work too" />
    
</VerticalLayout>